Staff - Female,,,,
"We absolutely need more women (or even just ONE to start) in senior leadership. We need more women in lower leadership levels as well. The lack of women and diversity in leadership is very upsetting and uninspiring to us women in the lower levels of the company who have no one to look up to. Also for anyone, even men, it is so obviously wrong in this day and age to have an all-white, all-male, completely non-diverse leadership team; anyone with half a brain knows that's not smart, as the best decisions can only be made with a variety of perspectives. So it makes all of us, not just women, lose faith in this company.  In addition to leadership desperately needing more women and diversity in general, my particular role (software developer) is also in great need of gender equality. It is still far too often the case that males make up all or 4/5 of a scrum team. This is absolutely unacceptable. It makes the single woman on the team feel completely alone with no female peer to relate to. I can say from personal experience that after too long like this you start to doubt whether you should even be a developer at all because you don't see any other developers who look or think like you do. And that's a horrible thing, because the last thing we need is women leaving software development. We need more women being brought into software development and encouraged to stay via female peers, especially at this company.",G_L_D_H,WE_upset_PO,WE_L_Cul_H,
we need to look at gender diversity per role instead of overall.  we have lots of women in lower-level positions but not in higher level positions,G_L_D,,,
"XXX talks a big game about promoting gender diversity, but leadership continues to be exclusively male and I have witnessed several occasions when qualified women lost out on a position to a male peer. ",GD_Talk_more_fix_few,CD_down.est,,
"I think it's been out of balance for a long time in the C suite, but recently, big improvements are being made. ",Impv_GD_H,,,
"A lot of talk about gender diversity, but haven't seen any actions.",CD_Talk_more_fix_few,,,
"It's very clear that the direct reports to SM (now Jeff Immelt) is all men, with the exception of Stephanie Zaremba, and as far as I can tell, she only oversees a handful of people. All of the SVPs are men - and they are the ones overseeing hundreds of employees. When Di Holman was brought in, I thought the women here might finally have a shot, and she only stayed for about 6 months. ",G_L_D_H,,,
This is hard!  There is not a silver bullet solution to solve this but I think the company talking about it and looking into multiple items they can try are a great next step.,Impv,,,
"Gender diversity exists among the longer cohorts, but the higher the cohort the more male dominant it becomes.",G_L_D_H,,,
"I think we've been working hard at this issue for a number of years and have made progress but not enough.  Two examples at the Leadership levels: (1) Jessie Collins should have been an SVP awhile ago.  Additionally, when Dan Haley was GC, he was listed on our external website but Jessie never has been - coincidence?  No, it's because she doesn't demand it from XXX like a man would.  Women here talk about this all the time and while it might not bother Jessie, it doesn't go unnoticed by female employees.  (2) This is compared to Tim O'Brien who needed a title change when he took a few of Steve Kahane's responsibilities on.  It is a widely held belief that he is only CMO because of Steven and good for him for politically maneuvering himself onto our C-suite.  If Tim actually knew what he was doing, his dept wouldn't be such a mess and Rob Cosinuke wouldn't have been  ""consulting"" since basically day one of Tim being CMO.",OTHER,,,
"It is concerning that all of senior leadership is male, especially as a woman beginning my career at XXX. It does not make me feel like this is a place I can grow in the long-term.",G_L_D_H,NEW,CA_Ceil_Fm,
"I'm lucky to work in the Epocrates client org, which has a great representation of women in management and director-level positions",N_CD_down.est,,,
It doesn't really exist about the Director level,NONE,,,
"I think that XXX does a great job at hiring a lot of high potential women, but the disappointment is that there are not many women leaders in the company. This is very discouraging as a woman to not see any women in director/upper level leadership positions. As a result, high performing women with the ambition to move into these ranks feel forced to leave XXX for opportunities elsewhere.",G_L_D_H,WE_upset_PO,,
"No gender diversity at ELT/SLT level, VP level or even Director level",G_L_D_H,,,
"The leadership team has been talking about gender diversity for a very long time, but I don't feel like we've seen much change. Our leadership team has been male dominated, and is still male dominated.",GD_Talk_more_fix_few,WE_MA,,
"There are some organizations within XXX such as Marketing that have a high number of women leaders, which makes sense with the makeup of the gender distribution within that organization. However, it does seem that within that organization, men are in leadership positions more frequently that the gender distribution of the whole division would predict if the distribution were to remain consistent across cohorts- particularly where it comes to people managers",G_L_D_H,OTHER,,
"There is diversity at the lower cohorts, but there is a clear glass ceiling for women by looking at the manager cohort and above.",CA_Ceil_Fm,,,
I see a lot of Women in low to mid level positions while I see more men in management and upper management.  ,G_L_D,,,
"I am not LGBTQ. However, I strongly support the idea of equality, acceptance, and diversity for people of all genders, and I love that XXX seems to be very progressive & open-minded in that regard, with XXX Proud and various other things.",OTHER,,,
"Gender diversity is somewhat adequate up to the levels where decision-making power resides. If our decision-makers are not diverse, and do not embrace diversity, nothing will change within the company. I'm disappointed that this survey is not taking an intersectional view of diversity.",OTHER,,,
"I think the company could use more women in leadership, but I also believe this should be forced just for the sake of having women in leadership roles.",N_GD_Prm,,,
"While leadership has stated via internal communication channels that ""gender diversity"" is important, I am afraid that there is too heavy of a commitment to gender parity between male and female as opposed to diversity including non-binary/ gender fluid employees. ",OTHER,,,
"As a female gender diversity isn't my main concern at this company, it's lack of intersectionality. Dan mentioned in his post we are focusing on gender diversity because we have to ""start somewhere"" this was a sad answer because I've had numerous white colleagues say they think XXX has plenty of POC (which in fact it doesn't). Maybe for some folks gender diversity is important, but I think when we are talking about gender diversity at XXX we are talking about white females. That is my honest opinion. ",WE_L_IntSec,WE_L_Cul,,
"Women are predominantly lower cohort than men here, the need to work excessive hours with unpredictable travel schedules inhibits women with family commitments (ex: child\elder care). Working remotely can be perceived as lack of effort.",G_L_D,,,
"From the ""staff"" to management level, yes there is a lot of gender diversity, but at the SVP level, there is not a lot of mix. It's a boys club",G_L_D_H,,,
None,NONE,,,
"while there seems to be an equal number of men and women working at XXX in terms of population, the distribution of men in leadership roles, or even management roles, is vastly higher than the distribution of those roles to women. It is extremely frustrating to watch male counterparts achieve career trajectory faster simply because of their gender and presence. ",G_L_D_H,,,
XXX offers gender diversity in selected departments. Other departments are exclusionary towards women and offer limited opportunity for upward mobility for women. The departments that offer gender diversity are lower paying departments.,G_L_D,OTHER,DEPARTMENT,
"Equally gender diverse as a whole, but skewed at different cohorts (i.e. ED, ELT)",G_L_D_H,,,
I would like to see more women and minorities in leadership positions (manager and above). I have a tough time thinking of any minorities in leadership positions that are female and/or a minority. It seems like white males are the most common followed by Indian and Asian males. Only women who are overqualified for a position seem to be able to move up the ladder. ,G_L_D_H,WE_L_Cul_H,,
There is a lot of diversity here.,N_G_L_D,N_WE_L_Cul,,
"I think gender diversity at XXX is wonderful until you look at the highest levels of senior leadership, where it is noticeably lacking",G_L_D_H,,,
Executive Leadership at XXX feels like the good old boys club.,WE_MA,,,
"We are all aware of the stats, the higher-up the less women. I believe XXX's reputation has been that it is ""sexist"" on top. I have heard this even before working here. I believe the company wants to have a better reputation regarding gender diversity but has not taken actions to achieve it (till now). It shouldn't end with surveys. I really would like to see more women be promoted or hired into leadership roles. I believe right now given the opportunity of the CEO position being open, it would mean so much for so many to see a qualified woman take the title.",G_L_D_H,G_Dis_Def_H,GD_Talk_more_fix_few,WE_PO_U
I think we do have an adequate amount of gender diversity at the company,N_G_L_D,,,
"It is very obvious that in any sales division outside of Small Groups Sales, there are zero women in leadership roles (Director or above).",G_L_D,DEPARTMENT,,
"There appears to be plenty of gender diversity in the lower cohorts, but the executive level lacks female leaders.",G_L_D_H,,,
general comment about this survey is that I didn't realize it was send out until a colleague of mine told me what to look for in my inbox.  I think this could have been sent out by a familiar name and should have had a simpler subject line.,,,,
"There seem to be a lot of women at XXX, but almost all of the senior leadership are men.",,,,
I don't see any difference in how men and women are treated at my level.  Treated equally as we should be.  Thank you.,,,,
"All you have to do is look around, and notice that our senior leadership is white men.  We need to have the same diversity we have in the associate/manager level be also at the very top. ",,,,
I'd like to see a gender balanced SLT. ,,,,
"The company is over 50 percent women. That statistic speaks for itself. That being said, there is a lack of diversity in the Director level and above. ",,,,
"There aren't enough women in the ELT. Our leaders always say that they are committed to bringing more women into the highest levels of leadership, but that would mean one of the men preaching those words would need to give up their spot to a woman. ",,,,
"it doesn't seem that many women are hired into leadership positions, and even fewer are retained",,,,
"My team is primarily women but the men seem to receive the most high-profile projects despite the fact that women in similar positions are equally as competent.  Lots of ladies at XXX, but I feel like I have seen guys in senior associate roles who are not nearly as competent as some of their female associate counterparts.  Why did they get promoted at all? ",,,,
Gender Diversity seems to break down past Sr. Leadership positions. ,,,,
Operations has a high percentage of female employees and is at the low end of the salary range.,,,,
I am too new to know and I work from home.,,,,
"XXX has been discussing this issue for years and nothing has changed.  women were surveyed abt 6 years ago on working conditions in terms of women getting promoted above say manager or  a few to director and nothing has changed, except there is a diversity dashboard where u can see the actual stats. same story  years later.   Feels like   old boys network /frat  boy cuture in some depts.     ",,,,
"Gender diversity does not exist at XXX. Even with women in management positions you'll see that these are in areas of ""support"", not technical, and usually in organizations that are more dismissed than more male dominated groups (i.e. CSC vs Product)",,,,
XXX is consistently providing communication regarding gender diversity at the workplace. They are being as transparent as they can. ,,,,
"It varies by cohort level and zone. Dev and R&D fail to attract females, while operations are mostly females. More than gender diversity, I'm concerned with age diversity. You do not see a lot of employees past their 40, and older employees, especially females are rarely promoted.",,,,
Would like to know more about what is being done to make the company more gender diverse.,,,,
"Being only a senior analyst I really was unable to answer some of the questions asking if certain options were available to women. It seems as if those would be available for those in senior leadership roles and above and the communication to those is not available to us on the ""lower levels"". I really feel that this survey would have been better off filled out from leadership up as the questions seemed mostly around those roles and what was available to them.",,,,
"Overall gender diversity, at least on the female/male binary, seems ok from a pure numbers perspective. But the lessening presence of women through cohorts has been disheartening since I got here. I do think ELT has finally come around to at least putting time towards this problem (I still remain unconvinced that they all actually care about the problem), which I'm grateful for. But time and energy only gets us so far; action, e.g. promoting Jessie Collins and Lorraine Townsend Vargas into SVP roles and having them join ELT, is the only way those gaps in gender diversity will be closed.",,,,
"I think gender diversity is something that needs improvement at the company, but I am happy to hear that this is something ELT is concentrating on.",,,,
I personally believe that women have all the same opportunities as men and it is on them to work hard to get there. I think we put too much emphasis on trying to make it a women friendly work environment when it already is. If some people worked as hard at their jobs as they do pushing a women friendly work environment they might reach their goals and the opportunities available. ,,,,
Lots of statistics around gender diversity are high level vs. looking at technical positions alone.,,,,
I am very happy to see so many women added to the ELT -- and sorry it took the recent mess for it to finally happen. Let's keep on this!,,,,
I believe there is a good diversity in the company. Surveys like this are aggravating because it leads people to believe this is not the case. If you want true equality between men and women then special programs for women lead you to believe that women are not equal and need special programs to advance. Why make programs geared to one gender but have them open to all? ,,,,
n/a,,,,
I have never thought we didn't have gender diversity at XXX. ,,,,
I don't have any knowledge of any issues,,,,
I think it is very diverse. ,,,,
Executive level leadership at XXX is dominated by white men and has been since i have been with the company. ,,,,
"Fantastic diversity here. Never seen or heard of any issues. Very positive workplace no matter your age, race, gender.",,,,
"We constantly hear that diversity is important to leadership at XXX. That said, we currently have zero female SVP's or above.",,,,
There seems to be equal amounts of male and female managers at least.,,,,
No advancement within this company or mentoring programs for women of color  (especially African Americans women). We barely get respect in our roles. ,,,,
"If a woman has to make a presentation with men present in the room, comments are made by men to derail or in some cases completely interrupt her presentation. A women's presentation is essentially treated as unimportant by men here, particularly men in leadership roles.",,,,
"We need more consistent gender diversity across all levels at XXX - right now, we only have it in the lowest levels of the company. Therefore, leadership is not representative of the population it serves which creates mistrust, unhappy employees, and decisions that do not reflect the people they impact the most.",,,,
"While a significant percentage of the staff cohort (senior associate and below) is comprised on women, that number steadily decreases as cohorts move up. While some of this can be attributable to women opting to leave the workforce in lieu of childcare responsibilities, compared to other companies XXX does have very flexible work from home policies, generous paternity/maternity leave, and it offers a good work-life balance (people usually work ~40 hours a week). Considering this, I find it hard to believe all the women that failed to progress from senior associate to management and above is due primarily to women leaving the work force. Female representation at XXX at the management and above level is not equal, and XXX loses top female talent because of it. ",,,,
" It was refreshing to see female leaders added to the executive leadership team.  Let's keep that up!  As a female, it is disheartening to look at your leaders and they are all men.  It would also be great to see more female leaders in OOCTO, specifically.  ",,,,
"The higher the management level, the worst the gender diversity.",,,,
I think it is absurd that we are taking a survey regarding gender diversity.,,,,
"At the Staff and Immediate Management level, I am please with the gender diversity I see at my day-to-day job. However, at the EVP level and above there is a disconcerting amount of women representation.",,,,
I have answered I don't know to most of the questions due to: I have been with the company for 1 month and I work remotely. I am not in the office environment to answer the questions any other way at this time.,,,,
"I would say there is gender inequality when it comes to positions in R&D-DEV. For the members of technical staff, there are far more men than women.  XXX would do well to hire more female developers. ",,,,
"Most of the times, it seems like the majority of women are clustered in the Manager or below tiers, with fewer and fewer making it above that level.  ",,,,
This is non existing with all leadership roles. As well as ethnic diversity.,,,,
"This survey was a complete miss on identifiable questions- This survey should have dug deeper and not asked only Director (leadership) and above questions. It should have been holistic to ALL cohorts. ""Staff"" (Sr Assoc, Assoc, Analyst, Rep) are the ones that suffer the MOST not having the growth opportunity and support!  ",,,,
I feel this should have no baring on how well an employee does their job. I have always thought the best person for the job (man or woman) is the one who gets the job. It should not be based on how many woman verses how many men do the job better. ,,,,
Lack of gender diversity at the leadership and executive levels has a significant impact on the culture of the company. Women do not feel that we have a path upward beyond Senior Manager/Director.,,,,
"I feel that my current team treats all team members equally, both with performance reviews and advancement opportunities. My prior team did not, and it was very obvious that you were not going to advance unless you were a man, or willing to participate in ""boys club"" activities. The manager in my prior department is well known for this habit. Its been called to the attention of the department manager, whose response was that someday he would need to be replaced if he's ever to promote and he couldn't do anything about the biased behavior, because the person committing it was the only person qualified to replace him.",,,,
Gender diversity in SLT is disappointing for women at XXX. Having diverse leaders show staff that they can succeed. ,,,,
Just wanted to note that Bret has really communicated his desire to see change in this area and I believe that he will be able to make progress in that area.,,,,
"We have a huge issue with gender diversity in leadership and also a large issue with gender diversity in software development roles.  There are almost no female role models high in the company hierarchy.  As a separate issue, there are also huge gaps for people of certain racial/ethnic backgrounds across all roles and leadership structure.  Additionally, though, the fact that this survey is being sent out seems like a positive step in the direction of increasing gender diversity awareness and action.",,,,
"Alot of talk, very little action. The company hides behind ERGS, strong women leadership has been fleeing, without response from senior leadership",,,,
There are currently many women in Director roles and below but that number significantly drops above the director level. ,,,,
when will we see a survey about the lack of diversity in leadership regarding other races/ethnicities? Diversity is more than just about women. ,,,,
There has been a total lack of gender diversity in leadership and I find this troubling. ,,,,
I perceive that there are more women being led by men than there are men being led by women (looking at the staff and manager levels),,,,
Statistically there is almost NO diversity in the most powerful positions - this points to deeper problems that are not being addressed. There are probably many reasons why these problem exist but the company should try to tackle them with every possible solution available. ,,,,
"The lack of women in top leadership positions is the biggest issue we face. I have not felt that the executive leadership team even saw this as a problem until recently, when outside publicity forced them to start making some statements. There is tremendous opportunity for actions here - widening the circle replacing SM direct reports is a great first step. ",,,,
"It is clear that the ""boys club"" SLT of SM's day had a trickle-down effect on other leadership, and it will take some time and mindfulness from SLT to hire a more diverse senior leadership team to help shape XXX in a more positive and accountable manner.",,,,
"Male or female, I honestly just want the best and most qualified candidate in the appropriate role. ",,,,
"It's really disturbing that none of our executive leaders are women. We've had woman executive leaders in the past, but I know at least one high-ranking female leader quit due to sexual harassment. XXX talks a lot about gender diversity and wanting to help women--but the executive leaders don't walk the walk. Seems to me they want to preserve the old boys' club.",,,,
Women to men ratio in team is not equal causing gender issues like women not being able to convey their opinion in team meetings.,,,,
"It doesn't appear to me that on the Collector team there's much gender diversity in leadership. It often seems like teams are being led by men when there are women in the same team who are equally if not more capable of managing the team - but happen not to have as much experience.   XXX talks a lot about diversity but given that hiring processes for a lot of teams are decentralized and teams need backfills quickly, the gender diversity of the team often gets overlooked.   ",,,,
There isn't much gender diversity in the higher management.,,,,
The number of men in executive/leadership roles severely outweighs women.,,,,
Gender diversity in OOCTO is really bad. Especially women of color vs white men. ,,,,
